{"artifact_sha256":"c9a2d42eafe56e3c54bb5c450f48f273f7026263c52b3b03471b35d55849844b","coverage_summary":{"identified":12,"missing":0,"needs_review":1,"total":13},"created_at":"2026-08-20T04:25:58.760464+00:00","input_hashes":{"media_source-02":"2f9213d9132ae3f7b1a8831aa01ead0d402ea342f3e2f0de0dc374f7e824086a","media_source-03":"aa1712278fe76e692c8418e856577196d2ee9711ceecf5fc9020a503db3c796a","media_source-04":"0757a4784647644cba0ad60521011215085d1f8a634dd08509a4ddb017e35f74","media_source-05":"ad38ded3aa91a16492c0997c173643a11da51b607c2eb2ce507467f02c91b87e","media_source-06":"6c9a821063ba05af5f221f87f492a2dea74ffb407f829a55940909d430a7564d","media_source-07":"114ffcd6f7c246bd48ddd96970c8e39e3ed4daa873dd3497cb88bddc36f336b2","reference":"d30d6ba211564cea3d89132b77b761019ce07b3bce941b56caabf21893a17715"},"producer":"research_projector@2.0","profile_ref":{"profile_id":"ecommerce-storyboard-cn","sha256":"0dd0f7e9dc42b1294b906f35eafbe249d6f2328c0420f77fca8f521a3085428a","version":"1.0"},"project_id":"table-mat-mix-v7","quality_warnings":["参考片 CTA 文字仅作为结构观察，不复制品牌信息","柔软回弹在参考片与自有素材之间只有部分动作证据，进入匹配时标记为桥接"],"reference_shots":[{"confidence_by_dimension":{"analyst_note":0.9,"audio_layers":0.9,"camera_angle":0.9,"camera_movement":0.9,"dialogue":1.0,"effect_treatment":0.9,"evidence_frames":0.9,"interval":0.9,"music_profile":0.9,"ordinal":0.9,"overlay_text":0.72,"setting":0.9,"shot_size":0.9,"visual_content":0.9},"evidence_refs":["analysis/reference/keyframes/frame_0000.jpg"],"interval":{"end_seconds_exclusive":1.0,"start_seconds":0.0},"media_id":"reference","observation_source":"manual","row_id":"reference-shot-1","values":{"analyst_note":"动作钩子清楚","audio_layers":["环境声","动作声","音乐"],"camera_angle":"平视","camera_movement":"轻微手持推进","dialogue":"","effect_treatment":"硬切；动作先行","evidence_frames":["analysis/reference/keyframes/frame_0000.jpg"],"interval":{"end_seconds_exclusive":1.0,"start_seconds":0.0},"music_profile":"轻快短促电商节奏","ordinal":1,"overlay_text":"贴合桌面","setting":"室内木桌与人物演示","shot_size":"中景","visual_content":"真人展开透明桌垫并对准木桌，第一秒同时交代产品和使用场景"},"warnings":[]},{"confidence_by_dimension":{"analyst_note":0.9,"audio_layers":0.9,"camera_angle":0.9,"camera_movement":0.9,"dialogue":1.0,"effect_treatment":0.9,"evidence_frames":0.9,"interval":0.9,"music_profile":0.9,"ordinal":0.9,"overlay_text":0.72,"setting":0.9,"shot_size":0.9,"visual_content":0.9},"evidence_refs":["analysis/reference/keyframes/frame_0001.jpg"],"interval":{"end_seconds_exclusive":2.067,"start_seconds":1.0},"media_id":"reference","observation_source":"manual","row_id":"reference-shot-2","values":{"analyst_note":"边缘证据强","audio_layers":["动作声","音乐"],"camera_angle":"俯拍","camera_movement":"推","dialogue":"","effect_treatment":"动作匹配切；快速推近","evidence_frames":["analysis/reference/keyframes/frame_0001.jpg"],"interval":{"end_seconds_exclusive":2.067,"start_seconds":1.0},"music_profile":"动作点明显","ordinal":2,"overlay_text":"贴合桌面","setting":"暖木色桌角近景","shot_size":"特写","visual_content":"镜头压到桌角和边缘，透明垫沿桌面轮廓贴合"},"warnings":[]},{"confidence_by_dimension":{"analyst_note":0.9,"audio_layers":0.9,"camera_angle":0.9,"camera_movement":0.9,"dialogue":1.0,"effect_treatment":0.9,"evidence_frames":0.9,"interval":0.9,"music_profile":0.9,"ordinal":0.9,"overlay_text":0.72,"setting":0.9,"shot_size":0.9,"visual_content":0.9},"evidence_refs":["analysis/reference/keyframes/frame_0002.jpg"],"interval":{"end_seconds_exclusive":3.767,"start_seconds":2.067},"media_id":"reference","observation_source":"manual","row_id":"reference-shot-3","values":{"analyst_note":"刮擦动作可见","audio_layers":["动作声","音乐"],"camera_angle":"俯拍","camera_movement":"跟拍","dialogue":"","effect_treatment":"硬切；动作跟随","evidence_frames":["analysis/reference/keyframes/frame_0002.jpg"],"interval":{"end_seconds_exclusive":3.767,"start_seconds":2.067},"music_profile":"高能量动作点","ordinal":3,"overlay_text":"防刮耐磨","setting":"木桌垫面局部","shot_size":"近景","visual_content":"硬物在垫面上刮擦，动作结果直接对应耐刮证明"},"warnings":[]},{"confidence_by_dimension":{"analyst_note":0.9,"audio_layers":0.9,"camera_angle":0.9,"camera_movement":0.9,"dialogue":1.0,"effect_treatment":0.9,"evidence_frames":0.9,"interval":0.9,"music_profile":0.9,"ordinal":0.9,"overlay_text":0.72,"setting":0.9,"shot_size":0.9,"visual_content":0.9},"evidence_refs":["analysis/reference/keyframes/frame_0003.jpg"],"interval":{"end_seconds_exclusive":6.4,"start_seconds":3.767},"media_id":"reference","observation_source":"manual","row_id":"reference-shot-4","values":{"analyst_note":"液体/油污证据可见","audio_layers":["动作声","音乐"],"camera_angle":"俯拍","camera_movement":"固定","dialogue":"","effect_treatment":"硬切；短促卖点字卡","evidence_frames":["analysis/reference/keyframes/frame_0003.jpg"],"interval":{"end_seconds_exclusive":6.4,"start_seconds":3.767},"music_profile":"连续证明段","ordinal":4,"overlay_text":"防水防油","setting":"木桌垫面局部","shot_size":"近景","visual_content":"液体/油污落在垫面上，连续展示防护和易处理"},"warnings":[]},{"confidence_by_dimension":{"analyst_note":0.9,"audio_layers":0.9,"camera_angle":0.9,"camera_movement":0.9,"dialogue":1.0,"effect_treatment":0.9,"evidence_frames":0.9,"interval":0.9,"music_profile":0.9,"ordinal":0.9,"overlay_text":0.72,"setting":0.9,"shot_size":0.9,"visual_content":0.9},"evidence_refs":["analysis/reference/keyframes/frame_0004.jpg"],"interval":{"end_seconds_exclusive":8.167,"start_seconds":6.4},"media_id":"reference","observation_source":"manual","row_id":"reference-shot-5","values":{"analyst_note":"回弹结果需逐帧确认","audio_layers":["动作声","音乐"],"camera_angle":"俯拍","camera_movement":"跟拍","dialogue":"","effect_treatment":"动作匹配切","evidence_frames":["analysis/reference/keyframes/frame_0004.jpg"],"interval":{"end_seconds_exclusive":8.167,"start_seconds":6.4},"music_profile":"节奏稍放缓","ordinal":5,"overlay_text":"柔软回弹","setting":"垫面局部与手部","shot_size":"特写","visual_content":"手部掀起并弯折垫面，展示柔软和可操作性"},"warnings":["柔软与回弹的最终结果需要在审核工作台逐帧确认"]},{"confidence_by_dimension":{"analyst_note":0.9,"audio_layers":0.9,"camera_angle":0.9,"camera_movement":0.9,"dialogue":1.0,"effect_treatment":0.9,"evidence_frames":0.9,"interval":0.9,"music_profile":0.9,"ordinal":0.9,"overlay_text":0.72,"setting":0.9,"shot_size":0.9,"visual_content":0.9},"evidence_refs":["analysis/reference/keyframes/frame_0005.jpg"],"interval":{"end_seconds_exclusive":9.967,"start_seconds":8.167},"media_id":"reference","observation_source":"manual","row_id":"reference-shot-6","values":{"analyst_note":"生活场景保留产品透明感","audio_layers":["环境声","音乐"],"camera_angle":"平视","camera_movement":"移","dialogue":"","effect_treatment":"稳定横移；生活场景收束","evidence_frames":["analysis/reference/keyframes/frame_0005.jpg"],"interval":{"end_seconds_exclusive":9.967,"start_seconds":8.167},"music_profile":"生活化收束","ordinal":6,"overlay_text":"贴合桌面","setting":"客厅/餐桌生活空间","shot_size":"中景","visual_content":"回到真人与餐桌环境，展示透明垫不遮住桌面质感"},"warnings":[]},{"confidence_by_dimension":{"analyst_note":0.9,"audio_layers":0.9,"camera_angle":0.9,"camera_movement":0.9,"dialogue":1.0,"effect_treatment":0.9,"evidence_frames":0.9,"interval":0.9,"music_profile":0.9,"ordinal":0.9,"overlay_text":0.72,"setting":0.9,"shot_size":0.9,"visual_content":0.9},"evidence_refs":["analysis/reference/keyframes/frame_0006.jpg","analysis/reference/keyframes/frame_0007.jpg"],"interval":{"end_seconds_exclusive":14.791,"start_seconds":9.967},"media_id":"reference","observation_source":"manual","row_id":"reference-shot-7","values":{"analyst_note":"参考品牌字样不可复用","audio_layers":["音乐"],"camera_angle":"平视","camera_movement":"固定","dialogue":"","effect_treatment":"静态停留；图形化收尾","evidence_frames":["analysis/reference/keyframes/frame_0006.jpg","analysis/reference/keyframes/frame_0007.jpg"],"interval":{"end_seconds_exclusive":14.791,"start_seconds":9.967},"music_profile":"尾段降速并留出阅读时间","ordinal":7,"overlay_text":"抖音搜索 CTA","setting":"深色 CTA 背景","shot_size":"全景","visual_content":"深色收尾卡，品牌头像、搜索框和账号信息引导搜索"},"warnings":["CTA文字可读但属于参考品牌信息，只作为结构观察，不进入成片"]}],"semantic_sha256":"bdb46993ca071216bb7c3fd6150f31ad608cd401f5328b52ba11296257911cf9","source_segments":[{"confidence_by_dimension":{"analyst_note":0.88,"audio_layers":0.88,"camera_angle":0.88,"camera_movement":0.88,"dialogue":0.95,"effect_treatment":0.88,"evidence_frames":0.88,"interval":0.88,"music_profile":0.88,"ordinal":0.88,"overlay_text":0.95,"setting":0.88,"shot_size":0.88,"visual_content":0.88},"evidence_refs":["analysis/source/2f9213d9132ae3f7b1a8831aa01ead0d402ea342f3e2f0de0dc374f7e824086a/frame_0001.jpg","analysis/source/2f9213d9132ae3f7b1a8831aa01ead0d402ea342f3e2f0de0dc374f7e824086a/frame_0002.jpg","analysis/source/2f9213d9132ae3f7b1a8831aa01ead0d402ea342f3e2f0de0dc374f7e824086a/frame_0003.jpg","analysis/source/2f9213d9132ae3f7b1a8831aa01ead0d402ea342f3e2f0de0dc374f7e824086a/frame_0004.jpg"],"interval":{"end_seconds_exclusive":8.01,"start_seconds":0.0},"media_id":"source-02","observation_source":"manual","row_id":"source-02-segment-1","values":{"analyst_note":"按整条素材体检，后续剪辑需重新取动作最清楚的区间","audio_layers":["动作声","环境声","音乐"],"camera_angle":"俯拍","camera_movement":"固定","dialogue":"","effect_treatment":"无明显后期特效，原始实拍","evidence_frames":["analysis/source/2f9213d9132ae3f7b1a8831aa01ead0d402ea342f3e2f0de0dc374f7e824086a/frame_0001.jpg","analysis/source/2f9213d9132ae3f7b1a8831aa01ead0d402ea342f3e2f0de0dc374f7e824086a/frame_0002.jpg","analysis/source/2f9213d9132ae3f7b1a8831aa01ead0d402ea342f3e2f0de0dc374f7e824086a/frame_0003.jpg","analysis/source/2f9213d9132ae3f7b1a8831aa01ead0d402ea342f3e2f0de0dc374f7e824086a/frame_0004.jpg"],"interval":{"end_seconds_exclusive":8.01,"start_seconds":0.0},"music_profile":"稳​​定说明节奏","ordinal":1,"overlay_text":"","setting":"木色桌面室内","shot_size":"中景","visual_content":"无甲醛检测仪器在桌面上进行检测，仪器读数是材质安全信任证据"},"warnings":[]},{"confidence_by_dimension":{"analyst_note":0.88,"audio_layers":0.88,"camera_angle":0.88,"camera_movement":0.88,"dialogue":0.95,"effect_treatment":0.88,"evidence_frames":0.88,"interval":0.88,"music_profile":0.88,"ordinal":0.88,"overlay_text":0.95,"setting":0.88,"shot_size":0.88,"visual_content":0.88},"evidence_refs":["analysis/source/aa1712278fe76e692c8418e856577196d2ee9711ceecf5fc9020a503db3c796a/frame_00